{
  "year": 2026,
  "rocYear": 115,
  "effectiveDate": "2026-01-01",
  "dataVersion": "2026.1.0",
  "sources": [
    {
      "topic": "勞工保險投保薪資分級表",
      "authority": "勞動部勞工保險局",
      "url": "https://www.bli.gov.tw/0005475.html",
      "document": "勞動部勞動保2字第1140091863號令",
      "issuedDate": "2025-11-21",
      "note": "114年11月21日修正發布，自115年1月1日施行"
    },
    {
      "topic": "勞工退休金月提繳分級表",
      "authority": "勞動部勞工保險局",
      "url": "https://www.bli.gov.tw/0013083.html",
      "document": "勞動部勞動福3字第1140153598號令",
      "issuedDate": "2025-11-24",
      "note": "自115年1月1日生效"
    },
    {
      "topic": "勞工職業災害保險投保薪資分級表",
      "authority": "勞動部勞工保險局",
      "url": "https://www.bli.gov.tw/0106148.html",
      "document": "勞工職業災害保險及保護法第17條第4項",
      "issuedDate": "2025-11-17",
      "note": "法規查詢 FL098312，自115年1月1日生效"
    },
    {
      "topic": "勞工職業災害保險費率",
      "authority": "勞動部",
      "url": "https://www.mol.gov.tw/1607/1632/1633/76836/",
      "document": "行業別災害平均費率0.14%＋上下班0.07%＝平均0.21%",
      "issuedDate": "2025-11-07",
      "note": "平均費率，個別行業0.05%~0.89%，可覆寫"
    },
    {
      "topic": "全民健康保險投保金額分級表",
      "authority": "衛生福利部中央健康保險署",
      "url": "https://www.nhi.gov.tw/ch/cp-19421-f9533-2569-1.html",
      "document": "衛部保字第1140153424號令",
      "issuedDate": "2025-12-12",
      "note": "114年12月12日發布，自115年1月1日施行；58級，第38級以下比照勞退分級表"
    },
    {
      "topic": "二代健保補充保險費率",
      "authority": "衛生福利部中央健康保險署",
      "url": "https://www.nhi.gov.tw/ch/cp-4516-74b0f-2613-1.html",
      "document": "補充保險費率2.11%",
      "issuedDate": "2021-01-01",
      "note": "自110年1月1日起為2.11%，115年沿用"
    }
  ],
  "minimumWage": {
    "monthly": 29500,
    "hourly": 196
  },
  "laborInsurance": {
    "rate": "0.125",
    "ordinaryRate": "0.115",
    "employmentInsuranceRate": "0.01",
    "rateWithoutEmploymentInsurance": "0.115",
    "burden": {
      "employer": "0.7",
      "employee": "0.2",
      "government": "0.1"
    },
    "note": "普通事故11.5%＋就業保險1%＝12.5%；不參加就保者以11.5%計。負擔比例勞工20%、雇主70%、政府10%。",
    "brackets": [
      {
        "grade": 1,
        "min": 0,
        "max": 29500,
        "insuredSalary": 29500
      },
      {
        "grade": 2,
        "min": 29501,
        "max": 30300,
        "insuredSalary": 30300
      },
      {
        "grade": 3,
        "min": 30301,
        "max": 31800,
        "insuredSalary": 31800
      },
      {
        "grade": 4,
        "min": 31801,
        "max": 33300,
        "insuredSalary": 33300
      },
      {
        "grade": 5,
        "min": 33301,
        "max": 34800,
        "insuredSalary": 34800
      },
      {
        "grade": 6,
        "min": 34801,
        "max": 36300,
        "insuredSalary": 36300
      },
      {
        "grade": 7,
        "min": 36301,
        "max": 38200,
        "insuredSalary": 38200
      },
      {
        "grade": 8,
        "min": 38201,
        "max": 40100,
        "insuredSalary": 40100
      },
      {
        "grade": 9,
        "min": 40101,
        "max": 42000,
        "insuredSalary": 42000
      },
      {
        "grade": 10,
        "min": 42001,
        "max": 43900,
        "insuredSalary": 43900
      },
      {
        "grade": 11,
        "min": 43901,
        "max": null,
        "insuredSalary": 45800
      }
    ],
    "partTimeBrackets": [
      {
        "grade": 1,
        "min": 0,
        "max": 11100,
        "insuredSalary": 11100
      },
      {
        "grade": 2,
        "min": 11101,
        "max": 12540,
        "insuredSalary": 12540
      },
      {
        "grade": 3,
        "min": 12541,
        "max": 13500,
        "insuredSalary": 13500
      },
      {
        "grade": 4,
        "min": 13501,
        "max": 15840,
        "insuredSalary": 15840
      },
      {
        "grade": 5,
        "min": 15841,
        "max": 16500,
        "insuredSalary": 16500
      },
      {
        "grade": 6,
        "min": 16501,
        "max": 17280,
        "insuredSalary": 17280
      },
      {
        "grade": 7,
        "min": 17281,
        "max": 17880,
        "insuredSalary": 17880
      },
      {
        "grade": 8,
        "min": 17881,
        "max": 19047,
        "insuredSalary": 19047
      },
      {
        "grade": 9,
        "min": 19048,
        "max": 20008,
        "insuredSalary": 20008
      },
      {
        "grade": 10,
        "min": 20009,
        "max": 21009,
        "insuredSalary": 21009
      },
      {
        "grade": 11,
        "min": 21010,
        "max": 22000,
        "insuredSalary": 22000
      },
      {
        "grade": 12,
        "min": 22001,
        "max": 23100,
        "insuredSalary": 23100
      },
      {
        "grade": 13,
        "min": 23101,
        "max": 24000,
        "insuredSalary": 24000
      },
      {
        "grade": 14,
        "min": 24001,
        "max": 25250,
        "insuredSalary": 25250
      },
      {
        "grade": 15,
        "min": 25251,
        "max": 26400,
        "insuredSalary": 26400
      },
      {
        "grade": 16,
        "min": 26401,
        "max": 27600,
        "insuredSalary": 27600
      },
      {
        "grade": 17,
        "min": 27601,
        "max": 28590,
        "insuredSalary": 28590
      }
    ]
  },
  "occupationalInsurance": {
    "defaultRate": "0.0021",
    "industryRateAvg": "0.0014",
    "commuteRate": "0.0007",
    "burden": {
      "employer": "1.0",
      "employee": "0.0",
      "government": "0.0"
    },
    "note": "職災保險費全額由雇主負擔；預設用平均費率0.21%，行業別可覆寫。",
    "brackets": [
      {
        "grade": 1,
        "min": 0,
        "max": 29500,
        "insuredSalary": 29500
      },
      {
        "grade": 2,
        "min": 29501,
        "max": 30300,
        "insuredSalary": 30300
      },
      {
        "grade": 3,
        "min": 30301,
        "max": 31800,
        "insuredSalary": 31800
      },
      {
        "grade": 4,
        "min": 31801,
        "max": 33300,
        "insuredSalary": 33300
      },
      {
        "grade": 5,
        "min": 33301,
        "max": 34800,
        "insuredSalary": 34800
      },
      {
        "grade": 6,
        "min": 34801,
        "max": 36300,
        "insuredSalary": 36300
      },
      {
        "grade": 7,
        "min": 36301,
        "max": 38200,
        "insuredSalary": 38200
      },
      {
        "grade": 8,
        "min": 38201,
        "max": 40100,
        "insuredSalary": 40100
      },
      {
        "grade": 9,
        "min": 40101,
        "max": 42000,
        "insuredSalary": 42000
      },
      {
        "grade": 10,
        "min": 42001,
        "max": 43900,
        "insuredSalary": 43900
      },
      {
        "grade": 11,
        "min": 43901,
        "max": 45800,
        "insuredSalary": 45800
      },
      {
        "grade": 12,
        "min": 45801,
        "max": 48200,
        "insuredSalary": 48200
      },
      {
        "grade": 13,
        "min": 48201,
        "max": 50600,
        "insuredSalary": 50600
      },
      {
        "grade": 14,
        "min": 50601,
        "max": 53000,
        "insuredSalary": 53000
      },
      {
        "grade": 15,
        "min": 53001,
        "max": 55400,
        "insuredSalary": 55400
      },
      {
        "grade": 16,
        "min": 55401,
        "max": 57800,
        "insuredSalary": 57800
      },
      {
        "grade": 17,
        "min": 57801,
        "max": 60800,
        "insuredSalary": 60800
      },
      {
        "grade": 18,
        "min": 60801,
        "max": 63800,
        "insuredSalary": 63800
      },
      {
        "grade": 19,
        "min": 63801,
        "max": 66800,
        "insuredSalary": 66800
      },
      {
        "grade": 20,
        "min": 66801,
        "max": 69800,
        "insuredSalary": 69800
      },
      {
        "grade": 21,
        "min": 69801,
        "max": null,
        "insuredSalary": 72800
      }
    ]
  },
  "healthInsurance": {
    "rate": "0.0517",
    "burden": {
      "employer": "0.6",
      "employee": "0.3",
      "government": "0.1"
    },
    "avgDependents": "0.56",
    "employerMultiplier": "1.56",
    "maxDependentsCharged": 3,
    "note": "第1類受僱者；費率5.17%。被保險人本人及眷屬各30%（眷屬上限3口），投保單位60%×1.56，政府10%×1.56。",
    "brackets": [
      {
        "grade": 1,
        "min": 0,
        "max": 29500,
        "insuredSalary": 29500
      },
      {
        "grade": 2,
        "min": 29501,
        "max": 30300,
        "insuredSalary": 30300
      },
      {
        "grade": 3,
        "min": 30301,
        "max": 31800,
        "insuredSalary": 31800
      },
      {
        "grade": 4,
        "min": 31801,
        "max": 33300,
        "insuredSalary": 33300
      },
      {
        "grade": 5,
        "min": 33301,
        "max": 34800,
        "insuredSalary": 34800
      },
      {
        "grade": 6,
        "min": 34801,
        "max": 36300,
        "insuredSalary": 36300
      },
      {
        "grade": 7,
        "min": 36301,
        "max": 38200,
        "insuredSalary": 38200
      },
      {
        "grade": 8,
        "min": 38201,
        "max": 40100,
        "insuredSalary": 40100
      },
      {
        "grade": 9,
        "min": 40101,
        "max": 42000,
        "insuredSalary": 42000
      },
      {
        "grade": 10,
        "min": 42001,
        "max": 43900,
        "insuredSalary": 43900
      },
      {
        "grade": 11,
        "min": 43901,
        "max": 45800,
        "insuredSalary": 45800
      },
      {
        "grade": 12,
        "min": 45801,
        "max": 48200,
        "insuredSalary": 48200
      },
      {
        "grade": 13,
        "min": 48201,
        "max": 50600,
        "insuredSalary": 50600
      },
      {
        "grade": 14,
        "min": 50601,
        "max": 53000,
        "insuredSalary": 53000
      },
      {
        "grade": 15,
        "min": 53001,
        "max": 55400,
        "insuredSalary": 55400
      },
      {
        "grade": 16,
        "min": 55401,
        "max": 57800,
        "insuredSalary": 57800